{"$schema":"https://json-schema.org/draft/2020-12/schema","$id":"cutover-control-ledger@v1","type":"object","additionalProperties":false,"required":["schema","transaction_id","sequence","event_id","epoch","source_watermark","source_digest","control_base","control_base_digest","allowed_write_authority","preconditions_digest","postconditions_digest"],"properties":{"schema":{"const":"cutover-control-ledger@v1"},"transaction_id":{"type":"string","minLength":1},"sequence":{"type":"integer","minimum":1},"previous_control_digest":{"type":"string","pattern":"^sha256:[0-9a-f]{64}$"},"event_id":{"type":"string","pattern":"^[0-9a-fA-F-]{36}$"},"epoch":{"enum":["legacy_active","legacy_frozen","prepared","issue_store_active","post_cutover_audit","legacy_restored","point_of_no_return","write_frozen_repair"]},"source_watermark":{"type":"string","pattern":"^[0-9a-f]{40}$"},"source_digest":{"type":"string","pattern":"^sha256:[0-9a-f]{64}$"},"candidate_watermark":{"type":"string","pattern":"^[0-9a-f]{40}$"},"candidate_digest":{"type":"string","pattern":"^sha256:[0-9a-f]{64}$"},"decision_watermark":{"type":"string","pattern":"^[0-9a-f]{40}$"},"cutover_watermark":{"type":"string","pattern":"^[0-9a-f]{40}$"},"cutover_digest":{"type":"string","pattern":"^sha256:[0-9a-f]{64}$"},"control_base":{"type":"string","pattern":"^[0-9a-f]{40}$"},"control_base_digest":{"type":"string","pattern":"^sha256:[0-9a-f]{64}$"},"authorization_ref":{"type":"string","minLength":1},"approval_ref":{"type":"string","minLength":1},"allowed_write_authority":{"enum":["legacy","issue-store","provenance-only","none"]},"preconditions_digest":{"type":"string","pattern":"^sha256:[0-9a-f]{64}$"},"postconditions_digest":{"type":"string","pattern":"^sha256:[0-9a-f]{64}$"},"abort_reason":{"type":"string","minLength":1}},"allOf":[{"if":{"properties":{"epoch":{"enum":["legacy_frozen","prepared","post_cutover_audit","legacy_restored","point_of_no_return","write_frozen_repair"]}}},"then":{"properties":{"allowed_write_authority":{"enum":["provenance-only","none"]}}}},{"if":{"properties":{"epoch":{"const":"issue_store_active"}}},"then":{"required":["candidate_watermark","candidate_digest","cutover_watermark","cutover_digest"],"properties":{"allowed_write_authority":{"const":"issue-store"}}}}]}
