{"schema":"cutover-control-ledger@v1","transaction_id":"tx-0037-a","sequence":3,"previous_control_digest":"sha256:aaaaaaaaaaaaaaaaaaaaaaaaaaaaaaaaaaaaaaaaaaaaaaaaaaaaaaaaaaaaaaaa","event_id":"018f5f10-2222-7222-8222-222222222222","epoch":"issue_store_active","source_watermark":"0123456789012345678901234567890123456789","source_digest":"sha256:aaaaaaaaaaaaaaaaaaaaaaaaaaaaaaaaaaaaaaaaaaaaaaaaaaaaaaaaaaaaaaaa","candidate_watermark":"1111111111111111111111111111111111111111","candidate_digest":"sha256:bbbbbbbbbbbbbbbbbbbbbbbbbbbbbbbbbbbbbbbbbbbbbbbbbbbbbbbbbbbbbbbb","cutover_watermark":"2222222222222222222222222222222222222222","cutover_digest":"sha256:bbbbbbbbbbbbbbbbbbbbbbbbbbbbbbbbbbbbbbbbbbbbbbbbbbbbbbbbbbbbbbbb","control_base":"3333333333333333333333333333333333333333","control_base_digest":"sha256:aaaaaaaaaaaaaaaaaaaaaaaaaaaaaaaaaaaaaaaaaaaaaaaaaaaaaaaaaaaaaaaa","authorization_ref":"refs/autodocs/cutover/0037/tx-0037-a","approval_ref":"refs/autodocs/approvals/0037/tx-0037-a","allowed_write_authority":"issue-store","preconditions_digest":"sha256:aaaaaaaaaaaaaaaaaaaaaaaaaaaaaaaaaaaaaaaaaaaaaaaaaaaaaaaaaaaaaaaa","postconditions_digest":"sha256:bbbbbbbbbbbbbbbbbbbbbbbbbbbbbbbbbbbbbbbbbbbbbbbbbbbbbbbbbbbbbbbb"}
